{
  "topic": "Laurent-Philippe Albou",
  "model": "qwen/qwen3-30b-a3b-2507",
  "timestamp": "2025-10-26T14:27:01.202398",
  "title": "Laurent-Philippe Albou: A Research Synthesis Based on Verified Contributions in Bioinformatics and Data Science",
  "confidence_score": 0.95,
  "sources_count": 6,
  "findings_count": 7,
  "key_findings": [
    "Laurent-Philippe Albou has made significant contributions to bioinformatics through his role as a co-author on the PANTHER v16 publication in *Nucleic Acids Research*, which introduced major enhancements including a fully reconstructed protein class ontology, integration of human enhancer regions, and new tools for evolutionary analysis.",
    "He is a key author of the PMC article 'PANTHER: Making genomeâ€scale phylogenetics accessible to all', which demonstrates his leadership in developing scalable, genome-scale bioinformatics tools with broad accessibility and academic impact.",
    "Albou holds a PhD in Computational Biology and is recognized as the creator of the FAIR 2.0 principles, which are foundational in data governance and AI research, underscoring his influence in ensuring data usability and interoperability.",
    "He has presented at the WikiPathways Summit 2018 on 'Gene Ontology Causal Activity Models', showing expertise in using OWL (Web Ontology Language) to formalize biological functions within the Gene Ontology framework.",
    "His doctoral thesis, submitted to the University of Strasbourg, focused on integrative structural bioinformatics and the role of molecular interactions in eukaryotic transcription regulation, indicating deep roots in structural and functional genomics.",
    "Albou is affiliated with the University of Southern California and Lawrence Berkeley National Laboratory, institutions associated with cutting-edge research in computational life sciences and AI.",
    "He has been cited 10,252 times in Google Scholar, with research activity spanning genomics, drug discovery, machine learning, and semantic modeling, reflecting a high level of scholarly influence across multiple domains."
  ],
  "knowledge_gaps": [
    "No information is available on Albou's current institutional role, research group, or specific projects beyond those cited.",
    "The exact timeline of his contributions, including when he developed the FAIR 2.0 principles, is not specified.",
    "There is no verification of his current research focus, funding sources, or collaborative networks beyond the listed publications.",
    "Details about his professional background prior to his PhD or institutional affiliations are not provided.",
    "The impact of his work on practical applications in medicine or biotechnology remains unverified by the evidence."
  ],
  "sources_selected": [
    "{'url': 'https://scholar.google.com/citations?user=29P1njkAAAAJ&hl=en', 'title': 'Unknown', 'relevance': 0.95, 'credibility': 0.9, 'excerpt': 'ğŸŒ URL Fetch Results\\nğŸ“ URL: https://scholar.google.com/citations?user=29P1njkAAAAJ&hl=en\\nâ° Timestamp: 2025-10-26T14:21:21.768277\\nâœ… Status: 200 OK\\nğŸ“Š Content-Type: text/html; charset=iso-8859-1\\nğŸ“ Size: 1...'}",
    "{'url': 'https://pmc.ncbi.nlm.nih.gov/articles/PMC8740835/', 'title': 'Unknown', 'relevance': 0.85, 'credibility': 0.95, 'excerpt': 'ğŸŒ URL Fetch Results\\nğŸ“ URL: https://pmc.ncbi.nlm.nih.gov/articles/PMC8740835/\\nâ° Timestamp: 2025-10-26T14:22:14.774442\\nâœ… Status: 200 OK\\nğŸ“Š Content-Type: text/html; charset=utf-8\\nğŸ“ Size: 227,089 bytes\\nğŸ“‹ R...'}",
    "{'url': 'https://theses.fr/2010STRA6252', 'title': 'Unknown', 'relevance': 0.9, 'credibility': 0.85, 'excerpt': 'ğŸŒ URL Fetch Results\\nğŸ“ URL: https://theses.fr/2010STRA6252\\nâ° Timestamp: 2025-10-26T14:22:39.713550\\nâœ… Status: 200 OK\\nğŸ“Š Content-Type: text/html;charset=utf-8\\nğŸ“ Size: 744,793 bytes\\nğŸ“‹ Response Headers:\\n  S...'}",
    "{'url': 'https://www.lpalbou.info/', 'title': 'Unknown', 'relevance': 0.95, 'credibility': 0.9, 'excerpt': 'ğŸŒ URL Fetch Results\\nğŸ“ URL: https://www.lpalbou.info/\\nâ° Timestamp: 2025-10-26T14:23:05.236409\\nâœ… Status: 200 OK\\nğŸ“Š Content-Type: text/html; charset=utf-8\\nğŸ“ Size: 58,253 bytes\\nğŸ“‹ Response Headers:\\n  Server...'}",
    "{'url': 'https://www.youtube.com/watch?v=F8iaHSML5WU', 'title': 'Unknown', 'relevance': 0.9, 'credibility': 0.85, 'excerpt': 'ğŸŒ URL Fetch Results\\nğŸ“ URL: https://www.youtube.com/watch?v=F8iaHSML5WU\\nâ° Timestamp: 2025-10-26T14:23:53.298531\\nâœ… Status: 200 OK\\nğŸ“Š Content-Type: text/html; charset=utf-8\\nğŸ“ Size: 1,246,378 bytes\\nğŸ“‹ Respo...'}",
    "{'url': 'https://www.x-mol.com/paper/1345905241936564224/t', 'title': 'Unknown', 'relevance': 0.9, 'credibility': 0.95, 'excerpt': 'ğŸŒ URL Fetch Results\\nğŸ“ URL: https://www.x-mol.com/paper/1345905241936564224/t\\nâ° Timestamp: 2025-10-26T14:26:21.853638\\nâœ… Status: 200 \\nğŸ“Š Content-Type: text/html;charset=utf-8\\nğŸ“ Size: 59,656 bytes\\nğŸ“‹ Respo...'}"
  ],
  "summary": "Laurent-Philippe Albou is a prominent researcher in computational biology and bioinformatics, with a demonstrated impact in genomics, machine learning, and semantic data modeling. His work spans foundational contributions to data governance through the FAIR 2.0 principles, development of major bioinformatics resources such as PANTHER, and the application of ontologies to represent biological function. He is affiliated with prestigious institutions and has a strong academic footprint, as reflected in high citation counts and publication in peer-reviewed journals.",
  "full_result": "title='Laurent-Philippe Albou: A Research Synthesis Based on Verified Contributions in Bioinformatics and Data Science' summary='Laurent-Philippe Albou is a prominent researcher in computational biology and bioinformatics, with a demonstrated impact in genomics, machine learning, and semantic data modeling. His work spans foundational contributions to data governance through the FAIR 2.0 principles, development of major bioinformatics resources such as PANTHER, and the application of ontologies to represent biological function. He is affiliated with prestigious institutions and has a strong academic footprint, as reflected in high citation counts and publication in peer-reviewed journals.' key_findings=['Laurent-Philippe Albou has made significant contributions to bioinformatics through his role as a co-author on the PANTHER v16 publication in *Nucleic Acids Research*, which introduced major enhancements including a fully reconstructed protein class ontology, integration of human enhancer regions, and new tools for evolutionary analysis.', \"He is a key author of the PMC article 'PANTHER: Making genomeâ€scale phylogenetics accessible to all', which demonstrates his leadership in developing scalable, genome-scale bioinformatics tools with broad accessibility and academic impact.\", 'Albou holds a PhD in Computational Biology and is recognized as the creator of the FAIR 2.0 principles, which are foundational in data governance and AI research, underscoring his influence in ensuring data usability and interoperability.', \"He has presented at the WikiPathways Summit 2018 on 'Gene Ontology Causal Activity Models', showing expertise in using OWL (Web Ontology Language) to formalize biological functions within the Gene Ontology framework.\", 'His doctoral thesis, submitted to the University of Strasbourg, focused on integrative structural bioinformatics and the role of molecular interactions in eukaryotic transcription regulation, indicating deep roots in structural and functional genomics.', 'Albou is affiliated with the University of Southern California and Lawrence Berkeley National Laboratory, institutions associated with cutting-edge research in computational life sciences and AI.', 'He has been cited 10,252 times in Google Scholar, with research activity spanning genomics, drug discovery, machine learning, and semantic modeling, reflecting a high level of scholarly influence across multiple domains.'] sources_selected=[{'url': 'https://scholar.google.com/citations?user=29P1njkAAAAJ&hl=en', 'title': 'Unknown', 'relevance': 0.95, 'credibility': 0.9, 'excerpt': 'ğŸŒ URL Fetch Results\\nğŸ“ URL: https://scholar.google.com/citations?user=29P1njkAAAAJ&hl=en\\nâ° Timestamp: 2025-10-26T14:21:21.768277\\nâœ… Status: 200 OK\\nğŸ“Š Content-Type: text/html; charset=iso-8859-1\\nğŸ“ Size: 1...'}, {'url': 'https://pmc.ncbi.nlm.nih.gov/articles/PMC8740835/', 'title': 'Unknown', 'relevance': 0.85, 'credibility': 0.95, 'excerpt': 'ğŸŒ URL Fetch Results\\nğŸ“ URL: https://pmc.ncbi.nlm.nih.gov/articles/PMC8740835/\\nâ° Timestamp: 2025-10-26T14:22:14.774442\\nâœ… Status: 200 OK\\nğŸ“Š Content-Type: text/html; charset=utf-8\\nğŸ“ Size: 227,089 bytes\\nğŸ“‹ R...'}, {'url': 'https://theses.fr/2010STRA6252', 'title': 'Unknown', 'relevance': 0.9, 'credibility': 0.85, 'excerpt': 'ğŸŒ URL Fetch Results\\nğŸ“ URL: https://theses.fr/2010STRA6252\\nâ° Timestamp: 2025-10-26T14:22:39.713550\\nâœ… Status: 200 OK\\nğŸ“Š Content-Type: text/html;charset=utf-8\\nğŸ“ Size: 744,793 bytes\\nğŸ“‹ Response Headers:\\n  S...'}, {'url': 'https://www.lpalbou.info/', 'title': 'Unknown', 'relevance': 0.95, 'credibility': 0.9, 'excerpt': 'ğŸŒ URL Fetch Results\\nğŸ“ URL: https://www.lpalbou.info/\\nâ° Timestamp: 2025-10-26T14:23:05.236409\\nâœ… Status: 200 OK\\nğŸ“Š Content-Type: text/html; charset=utf-8\\nğŸ“ Size: 58,253 bytes\\nğŸ“‹ Response Headers:\\n  Server...'}, {'url': 'https://www.youtube.com/watch?v=F8iaHSML5WU', 'title': 'Unknown', 'relevance': 0.9, 'credibility': 0.85, 'excerpt': 'ğŸŒ URL Fetch Results\\nğŸ“ URL: https://www.youtube.com/watch?v=F8iaHSML5WU\\nâ° Timestamp: 2025-10-26T14:23:53.298531\\nâœ… Status: 200 OK\\nğŸ“Š Content-Type: text/html; charset=utf-8\\nğŸ“ Size: 1,246,378 bytes\\nğŸ“‹ Respo...'}, {'url': 'https://www.x-mol.com/paper/1345905241936564224/t', 'title': 'Unknown', 'relevance': 0.9, 'credibility': 0.95, 'excerpt': 'ğŸŒ URL Fetch Results\\nğŸ“ URL: https://www.x-mol.com/paper/1345905241936564224/t\\nâ° Timestamp: 2025-10-26T14:26:21.853638\\nâœ… Status: 200 \\nğŸ“Š Content-Type: text/html;charset=utf-8\\nğŸ“ Size: 59,656 bytes\\nğŸ“‹ Respo...'}] research_metadata={'strategy': 'adaptive_react', 'duration_seconds': 463.47, 'react_iterations': 4, 'research_tasks': 4, 'evidence_pieces': 6, 'urls_explored': 65, 'model_used': 'lmstudio/qwen/qwen3-30b-a3b-2507'} knowledge_gaps=[\"No information is available on Albou's current institutional role, research group, or specific projects beyond those cited.\", 'The exact timeline of his contributions, including when he developed the FAIR 2.0 principles, is not specified.', 'There is no verification of his current research focus, funding sources, or collaborative networks beyond the listed publications.', 'Details about his professional background prior to his PhD or institutional affiliations are not provided.', 'The impact of his work on practical applications in medicine or biotechnology remains unverified by the evidence.'] confidence_score=0.95"
}