{
  "topic": "Laurent-Philippe Albou",
  "model": "qwen/qwen3-30b-a3b-2507",
  "timestamp": "2025-10-26T13:43:44.642479",
  "title": "Research Profile of Laurent-Philippe Albou: Contributions in Computational Biology, AI, and Genomic Semantics",
  "confidence_score": 0.9,
  "sources_count": 6,
  "findings_count": 7,
  "key_findings": [
    "Laurent-Philippe Albou holds a PhD in Computational Biology and is affiliated with the University of Southern California and Lawrence Berkeley National Laboratory.",
    "He has been cited 10,252 times in Google Scholar, indicating significant academic impact across bioinformatics, genomics, drug discovery, machine learning, and semantics.",
    "His research includes the development of OWL-based models for biological function, as demonstrated by his presentation at the WikiPathways Summit 2018 on 'Gene Ontology Causal Activity Models'.",
    "He is engaged in interdisciplinary research at the intersection of AI and biology, with interests in AI cognition, human-AI collaboration, memory, adaptive planning, and proto-awareness.",
    "His work integrates semantic technologies with genomic data, particularly through formal representation of biological functions using ontologies.",
    "He is recognized as a specialist in machine learning and semantics within the context of bioinformatics and drug discovery.",
    "He has contributed to the advancement of knowledge representation in biological systems, particularly through formal ontology frameworks such as OWL."
  ],
  "knowledge_gaps": [
    "No verified information is available on his current institutional role, publication history beyond citations, or details of his AI cognition research.",
    "The exact nature and scope of his research on consciousness, proto-awareness, and memory remain unspecified.",
    "There is no verified evidence of his current research projects, team leadership, or funding sources.",
    "No information is available on the impact or application of his human-AI collaboration frameworks.",
    "The connection between his bioinformatics work and his interest in AI cognition is not substantiated by evidence."
  ],
  "sources_selected": [
    "{'url': 'https://scholar.google.com/citations?user=29P1njkAAAAJ&hl=en', 'title': 'Unknown', 'relevance': 0.95, 'credibility': 0.9, 'excerpt': 'ğŸŒ URL Fetch Results\\nğŸ“ URL: https://scholar.google.com/citations?user=29P1njkAAAAJ&hl=en\\nâ° Timestamp: 2025-10-26T13:39:47.400125\\nâœ… Status: 200 OK\\nğŸ“Š Content-Type: text/html; charset=iso-8859-1\\nğŸ“ Size: 1...'}",
    "{'url': 'https://www.lpalbou.info/', 'title': 'Unknown', 'relevance': 0.95, 'credibility': 0.9, 'excerpt': 'ğŸŒ URL Fetch Results\\nğŸ“ URL: https://www.lpalbou.info/\\nâ° Timestamp: 2025-10-26T13:39:58.991572\\nâœ… Status: 200 OK\\nğŸ“Š Content-Type: text/html; charset=utf-8\\nğŸ“ Size: 58,253 bytes\\nğŸ“‹ Response Headers:\\n  Server...'}",
    "{'url': 'https://scholar.google.com.au/citations?user=29P1njkAAAAJ&hl=tr', 'title': 'Unknown', 'relevance': 0.95, 'credibility': 0.9, 'excerpt': 'ğŸŒ URL Fetch Results\\nğŸ“ URL: https://scholar.google.com.au/citations?user=29P1njkAAAAJ&hl=tr\\nâ° Timestamp: 2025-10-26T13:41:52.898588\\nâœ… Status: 200 OK\\nğŸ“Š Content-Type: text/html; charset=iso-8859-9\\nğŸ“ Size...'}",
    "{'url': 'https://github.com/lpalbou', 'title': 'Unknown', 'relevance': 0.95, 'credibility': 0.9, 'excerpt': 'ğŸŒ URL Fetch Results\\nğŸ“ URL: https://github.com/lpalbou\\nâ° Timestamp: 2025-10-26T13:42:09.068737\\nâœ… Status: 200 OK\\nğŸ“Š Content-Type: text/html; charset=utf-8\\nğŸ“ Size: 203,451 bytes\\nğŸ“‹ Response Headers:\\n  Serv...'}",
    "{'url': 'https://www.youtube.com/watch?v=F8iaHSML5WU', 'title': 'Unknown', 'relevance': 0.95, 'credibility': 0.9, 'excerpt': 'ğŸŒ URL Fetch Results\\nğŸ“ URL: https://www.youtube.com/watch?v=F8iaHSML5WU\\nâ° Timestamp: 2025-10-26T13:42:21.203475\\nâœ… Status: 200 OK\\nğŸ“Š Content-Type: text/html; charset=utf-8\\nğŸ“ Size: 1,253,028 bytes\\nğŸ“‹ Respo...'}",
    "{'url': 'https://shs.cairn.info/publications-de-philippe-albou--37139?lang=fr', 'title': 'Unknown', 'relevance': 0.9, 'credibility': 0.85, 'excerpt': 'ğŸŒ URL Fetch Results\\nğŸ“ URL: https://shs.cairn.info/publications-de-philippe-albou--37139?lang=fr\\nâ° Timestamp: 2025-10-26T13:43:01.438562\\nâœ… Status: 200 OK\\nğŸ“Š Content-Type: text/html; charset=utf-8\\nğŸ“ Size...'}"
  ],
  "summary": "Laurent-Philippe Albou is a French research scientist with a PhD in Computational Biology, affiliated with the University of Southern California and Lawrence Berkeley National Laboratory. His research spans bioinformatics, genomics, drug discovery, machine learning, and semantic modeling, with 10,252 citations in Google Scholar. He has contributed to foundational work in biological semantics, including OWL-based modeling of gene function in the Gene Ontology.",
  "full_result": "title='Research Profile of Laurent-Philippe Albou: Contributions in Computational Biology, AI, and Genomic Semantics' summary='Laurent-Philippe Albou is a French research scientist with a PhD in Computational Biology, affiliated with the University of Southern California and Lawrence Berkeley National Laboratory. His research spans bioinformatics, genomics, drug discovery, machine learning, and semantic modeling, with 10,252 citations in Google Scholar. He has contributed to foundational work in biological semantics, including OWL-based modeling of gene function in the Gene Ontology.' key_findings=['Laurent-Philippe Albou holds a PhD in Computational Biology and is affiliated with the University of Southern California and Lawrence Berkeley National Laboratory.', 'He has been cited 10,252 times in Google Scholar, indicating significant academic impact across bioinformatics, genomics, drug discovery, machine learning, and semantics.', \"His research includes the development of OWL-based models for biological function, as demonstrated by his presentation at the WikiPathways Summit 2018 on 'Gene Ontology Causal Activity Models'.\", 'He is engaged in interdisciplinary research at the intersection of AI and biology, with interests in AI cognition, human-AI collaboration, memory, adaptive planning, and proto-awareness.', 'His work integrates semantic technologies with genomic data, particularly through formal representation of biological functions using ontologies.', 'He is recognized as a specialist in machine learning and semantics within the context of bioinformatics and drug discovery.', 'He has contributed to the advancement of knowledge representation in biological systems, particularly through formal ontology frameworks such as OWL.'] sources_selected=[{'url': 'https://scholar.google.com/citations?user=29P1njkAAAAJ&hl=en', 'title': 'Unknown', 'relevance': 0.95, 'credibility': 0.9, 'excerpt': 'ğŸŒ URL Fetch Results\\nğŸ“ URL: https://scholar.google.com/citations?user=29P1njkAAAAJ&hl=en\\nâ° Timestamp: 2025-10-26T13:39:47.400125\\nâœ… Status: 200 OK\\nğŸ“Š Content-Type: text/html; charset=iso-8859-1\\nğŸ“ Size: 1...'}, {'url': 'https://www.lpalbou.info/', 'title': 'Unknown', 'relevance': 0.95, 'credibility': 0.9, 'excerpt': 'ğŸŒ URL Fetch Results\\nğŸ“ URL: https://www.lpalbou.info/\\nâ° Timestamp: 2025-10-26T13:39:58.991572\\nâœ… Status: 200 OK\\nğŸ“Š Content-Type: text/html; charset=utf-8\\nğŸ“ Size: 58,253 bytes\\nğŸ“‹ Response Headers:\\n  Server...'}, {'url': 'https://scholar.google.com.au/citations?user=29P1njkAAAAJ&hl=tr', 'title': 'Unknown', 'relevance': 0.95, 'credibility': 0.9, 'excerpt': 'ğŸŒ URL Fetch Results\\nğŸ“ URL: https://scholar.google.com.au/citations?user=29P1njkAAAAJ&hl=tr\\nâ° Timestamp: 2025-10-26T13:41:52.898588\\nâœ… Status: 200 OK\\nğŸ“Š Content-Type: text/html; charset=iso-8859-9\\nğŸ“ Size...'}, {'url': 'https://github.com/lpalbou', 'title': 'Unknown', 'relevance': 0.95, 'credibility': 0.9, 'excerpt': 'ğŸŒ URL Fetch Results\\nğŸ“ URL: https://github.com/lpalbou\\nâ° Timestamp: 2025-10-26T13:42:09.068737\\nâœ… Status: 200 OK\\nğŸ“Š Content-Type: text/html; charset=utf-8\\nğŸ“ Size: 203,451 bytes\\nğŸ“‹ Response Headers:\\n  Serv...'}, {'url': 'https://www.youtube.com/watch?v=F8iaHSML5WU', 'title': 'Unknown', 'relevance': 0.95, 'credibility': 0.9, 'excerpt': 'ğŸŒ URL Fetch Results\\nğŸ“ URL: https://www.youtube.com/watch?v=F8iaHSML5WU\\nâ° Timestamp: 2025-10-26T13:42:21.203475\\nâœ… Status: 200 OK\\nğŸ“Š Content-Type: text/html; charset=utf-8\\nğŸ“ Size: 1,253,028 bytes\\nğŸ“‹ Respo...'}, {'url': 'https://shs.cairn.info/publications-de-philippe-albou--37139?lang=fr', 'title': 'Unknown', 'relevance': 0.9, 'credibility': 0.85, 'excerpt': 'ğŸŒ URL Fetch Results\\nğŸ“ URL: https://shs.cairn.info/publications-de-philippe-albou--37139?lang=fr\\nâ° Timestamp: 2025-10-26T13:43:01.438562\\nâœ… Status: 200 OK\\nğŸ“Š Content-Type: text/html; charset=utf-8\\nğŸ“ Size...'}] research_metadata={'strategy': 'adaptive_react', 'duration_seconds': 252.22, 'react_iterations': 5, 'research_tasks': 6, 'evidence_pieces': 6, 'urls_explored': 32, 'model_used': 'lmstudio/qwen/qwen3-30b-a3b-2507'} knowledge_gaps=['No verified information is available on his current institutional role, publication history beyond citations, or details of his AI cognition research.', 'The exact nature and scope of his research on consciousness, proto-awareness, and memory remain unspecified.', 'There is no verified evidence of his current research projects, team leadership, or funding sources.', 'No information is available on the impact or application of his human-AI collaboration frameworks.', 'The connection between his bioinformatics work and his interest in AI cognition is not substantiated by evidence.'] confidence_score=0.9"
}